{
  "version": "1",
  "title": "Explain-to-Me: docs with a pulse",
  "profile": "preview",
  "targetDurationMs": 138000,
  "theme": "technical-whiteboard",
  "scenes": [
    {"id":"hello","kind":"title","title":"Your docs. With a pulse.","visual":{"subtitle":"Explain-to-Me · v0.2"},"narration":[{"id":"hello-1","text":"Your document has important things to say. Unfortunately, it is a document. It has no mouth."},{"id":"hello-2","text":"Meet Explain-to-Me: a local-first toolkit that turns your words into narrated, captioned explainer videos. Tiny movie studio. Extremely sensible shoes."}]},
    {"id":"factory","kind":"statement","title":"A tiny explanation factory","visual":{"lines":["Source → manifest → voice → video"]},"narration":[{"id":"factory-1","text":"Here is the conveyor belt. Start with Markdown, plain text, or a reviewed production manifest."},{"id":"factory-2","text":"The toolkit prepares narration, measures the actual speech, then builds the timeline around it. Diagrams, code cards, captions. Everybody arrives together. Nobody gets shoved off the bus."}]},
    {"id":"setup","kind":"statement","title":"Give it a desk to dance on","visual":{"lines":["macOS · Node 24+ · Git · FFmpeg"]},"narration":[{"id":"setup-1","text":"For version zero point two, bring a Mac, Node twenty-four or newer, Git, and F F mpeg."},{"id":"setup-2","text":"Clone the repository. Install the pinned dependencies. Download the rendering browser once, then run doctor. The README has the exact commands. Doctor checks the tools. It does not check your dance moves."}]},
    {"id":"first","kind":"statement","title":"Training wheels. Movie reels.","visual":{"lines":["Prepared manifest + Apple speech"]},"narration":[{"id":"first-1","text":"Make your first video with the bundled manifest and Apple speech. No extra language model required."},{"id":"first-2","text":"Choose a fresh output folder, run the build, and open video dot M P four. Congratulations! Your terminal has entered its film director era."}]},
    {"id":"document","kind":"statement","title":"Give your own ideas a speaking part","visual":{"lines":["Markdown or plain text"]},"narration":[{"id":"document-1","text":"Next, hand it your own Markdown or text file. Template mode selects source material directly."},{"id":"document-2","text":"Want local model direction and a smoother voice? Install the optional director and Kokoro models, then choose those backends. Setup downloads the tools; inference runs locally. Always review what the model writes."}]},
    {"id":"outputs","kind":"statement","title":"The goodie bag has receipts","visual":{"lines":["video.mp4 · captions · manifest · report"]},"narration":[{"id":"outputs-1","text":"Your output folder includes the movie, narration audio, captions, manifest, and a report."},{"id":"outputs-2","text":"Keep the manifest to revise the script. Check the report. Watch and listen before sharing. Automated checks can catch broken timing; they cannot tell whether your explanation is secretly about a potato."}]},
    {"id":"agent","kind":"statement","title":"Your agent can hold the clapperboard","visual":{"lines":["Copy the installer prompt from the README"]},"narration":[{"id":"agent-1","text":"Prefer a robot assistant? Copy the quick installer prompt from the README into your coding agent."},{"id":"agent-2","text":"It sets up the pinned release, checks prerequisites, and keeps your private stories outside the software checkout. You review the finished movie. The robot gets a tiny imaginary director chair."}]},
    {"id":"outro","kind":"outro","title":"Less wall of text. More aha!","visual":{"subtitle":"Open source · v0.2.0"},"narration":[{"id":"outro-1","text":"Version zero point two ships the technical whiteboard style. These cartoons and this music are a custom release showcase."},{"id":"outro-2","text":"Grab the code. Explain something useful. Make somebody go, oh, now I get it! Explain-to-Me. Less wall of text. More aha."}]}
  ]
}
